part,5
,,727537,中美晶凱基16購06
,,727538,台燿凱基18購01
,,727539,光頡凱基17購01
,,727540,佳邦凱基16購02
,,727541,茂達凱基17購01
,,727542,泰博凱基16購01
,,727543,晶焱凱基17購02
,,727544,晶焱凱基1A購01
,,727545,群聯凱基1B購01
,,727546,精華凱基18購01
,,727547,點序凱基18購01
,,727548,威剛富邦17購01
,,727549,精測富邦17購01
,,727550,聚積富邦18購01
,,727551,FH中5G群益18購01
,,727552,加高群益17購01
,,727553,美琪瑪群益18購01
,,727554,倉和群益18購01
,,727555,晶焱群益16購04
,,727556,晶焱群益16購05
,,727557,聚積群益16購01
,,727558,驊訊群益18購01
,,727559,群聯國泰18購01
,,727560,加高兆豐16購02
,,727561,網家兆豐16購01
,,727562,聚積康和16購01
,,727563,M31群益16購02
,,727564,力旺群益16購02
,,727565,台燿群益16購02
,,727566,旺矽群益16購02
,,727567,朋程群益16購01
,,727568,威剛群益16購02
,,727569,萬泰科群益16購01
,,727570,元太統一18購03
,,727571,美琪瑪統一17購04
,,727572,茂達統一1A購01
,,727573,聚積統一18購01
,,727574,點序統一17購06
,,727575,中美晶凱基17購03
,,727576,元太凱基16購05
,,727577,世界凱基1A購01
,,727578,鈦昇凱基18購01
,,727579,萬潤凱基16購02
,,727580,群聯凱基1C購02
,,727581,漢磊凱基19購02
,,727582,雙鴻凱基1A購01
,,727583,穩懋凱基1A購01
,,727584,中美晶元大16購06
,,727585,中美晶元大16購07
,,727586,光頡元大17購01
,,727587,茂迪元大16購01
,,727588,茂迪元大18購02
,,727589,晶焱元大16購02
,,727590,晶焱元大16購03
,,727591,萬泰科元大17購02
,,727592,群聯元大16購12
,,727593,聚和元大16購02
,,727594,凡甲國票17購01
,,727595,中美晶國票17購02
,,727596,元太國票17購03
,,727597,茂迪國票18購01
,,727598,茂迪國票18購02
,,727599,晶焱國票17購01
,,727600,萬泰科國票17購01
,,727601,大樹麥證18購01
,,727602,頎邦麥證16購01
,,727603,大宇資中信17購01
,,727604,美琪瑪中信18購01
,,727605,鈊象中信17購01
,,727606,群聯中信19購01
,,727607,穩懋中信17購01
,,727608,穩懋中信19購01
,,727609,大宇資永豐16購01
,,727610,中美晶永豐16購01
,,727611,台燿永豐16購01
,,727612,信驊永豐16購01
,,727613,晶焱永豐17購01
,,727614,萬潤永豐16購01
,,727615,漢磊永豐16購02
,,727616,碩禾永豐16購01
,,727617,廣明永豐16購02
,,727618,點序永豐16購02
,,727619,光頡元富16購04
,,727620,茂迪元富16購02
,,727621,中光電兆豐18購01
,,727622,元太兆豐17購02
,,727623,家登兆豐16購01
,,727624,晶焱兆豐16購01
,,727625,元太康和16購01
,,727626,聚積康和17購01
,,727627,佳邦國票17購01
,,727628,威剛國票17購01
,,727629,家登國票18購01
,,727630,創惟國票17購02
,,727631,榮剛國票17購01
,,727632,穩懋國票17購02
,,727633,中美晶統一17購01
,,727634,中美晶統一17購02
,,727635,元太統一17購02
,,727636,茂達統一1A購02
,,727637,聚積統一18購02
,,727638,廣明統一17購01
,,727639,雙鴻統一19購01
,,727640,同致元大16購01
,,727641,宜鼎元大16購01
,,727642,旺矽元大16購02
,,727643,建錩元大16購01
,,727644,萬泰科元大16購01
,,727645,萬泰科元大18購02
,,727646,群聯元大16購13
,,727647,群聯元大16購14
,,727648,聖暉元大16購01
,,727649,台半中信19購01
,,727650,鈦昇中信18購01
,,727651,新普中信16購01
,,727652,聖暉中信16購01
,,727653,朋程永豐16購01
,,727654,茂迪永豐17購01
,,727655,益安永豐16購01
,,727656,閎康永豐16購01
,,727657,群聯永豐16購02
,,727658,榮剛永豐16購01
,,727659,碩禾永豐16購02
,,727660,穩懋永豐16購02
,,727661,中美晶凱基17購04
,,727662,晶焱凱基18購01
,,727663,閎康凱基17購01
,,727664,聚積凱基17購01
,,727665,優群凱基19購01
,,727666,穩懋凱基1A購02
,,727667,元太富邦18購01
,,727668,穩懋富邦18購02
,,727669,中美晶國泰18購02
,,727670,茂迪國泰18購02
,,727671,中美晶元富1C購01
,,727672,元太元富19購01
,,727673,元太元富19購02
,,727674,頎邦元富16購01
,,727675,昇佳電兆豐18購01
,,727676,萬泰科康和17購01
,,727677,萬泰科康和18購01
,,727678,M31群益16購03
,,727679,安國群益17購01
,,727680,安國群益19購01
,,727681,茂達群益16購02
,,727682,紘康群益18購01
,,727683,萬泰科群益16購02
,,727684,群聯群益16購03
,,727685,精華群益16購01
,,727686,點序群益16購01
,,727687,櫃200群益16購01
,,727688,光頡國票16購01
,,727689,晶焱國票17購02
,,727690,鈦昇國票17購02
,,727691,萬泰科國票17購03
,,727692,萬泰科國票17購04
,,727693,精星國票17購01
,,727694,合晶統一17購02
,,727695,群聯統一17購02
,,727696,萬泰科國泰18購01
,,727697,群聯國泰18購02
,,727698,群聯國泰18購03
,,727699,大田凱基16購01
,,727700,中美晶凱基16購07
,,727701,合晶凱基1A購03
,,727702,原相凱基16購02
,,727703,群聯凱基16購06
,,727704,精星凱基16購01
,,727705,聚積凱基16購01
,,727706,聚積凱基16購02
,,727707,聚積凱基1A購01
,,727708,群聯富邦17購01
,,727709,雙鴻富邦17購01
,,727710,世界日盛16購01
,,727711,鈊象日盛16購01
,,727712,中美晶元大18購01
,,727713,中菲行元大16購02
,,727714,元太元大16購09
,,727715,台燿元大16購02
,,727716,合晶元大17購06
,,727717,佳邦元大16購02
,,727718,長科*元大17購01
,,727719,信驊元大16購04
,,727720,茂迪元大16購02
,,727721,晶焱元大16購04
,,727722,萬潤元大16購02
,,727723,碩禾元大1A購01
,,727724,精星元大18購01
,,727725,臺慶科元大17購01
,,727726,優群元大16購05
,,727727,穩懋元大16購04
,,727728,驊訊元大1A購01
,,727729,元太台新16購01
,,727730,佳邦台新16購01
,,727731,凡甲麥證16購01
,,727732,加高麥證16購01
,,727733,合晶麥證16購01
,,727734,榮剛麥證16購01
,,727735,中美晶群益16購04
,,727736,長聖群益17購01
,,727737,茂達群益16購03
,,727738,家登群益16購01
,,727739,紘康群益16購01
,,727740,雍智群益16購01
,,727741,鈺太群益16購01
,,727742,精星群益16購04
,,727743,聚積群益17購01
,,727744,聚積群益19購01
,,727745,合晶元富19購01
,,727746,合晶元富19購02
,,727747,合晶兆豐17購02
,,727748,九暘康和18購01
,,727749,美琪瑪康和18購01
,,727750,力旺中信18購01
,,727751,中菲行中信16購01
,,727752,元太中信19購01
,,727753,九暘永豐16購01
,,727754,合晶永豐16購03
,,727755,精星永豐16購01
,,727756,聚積永豐16購02
,,727757,廣明永豐17購01
,,727758,伍豐國票17購01
,,727759,宇峻國票17購01
,,727760,旺矽國票17購01
,,727761,智冠國票17購01
,,727762,聚積國票17購02
,,727763,廣明國票17購02
,,727764,廣運國票17購01
,,727765,智冠統一1A購01
,,727766,智冠統一1B購01
,,727767,群聯統一16購03
,,727768,九暘凱基17購01
,,727769,大宇資凱基17購01
,,727770,元太凱基17購04
,,727771,伍豐凱基18購01
,,727772,長科*凱基17購01
,,727773,威剛凱基16購03
,,727774,美琪瑪凱基17購02
,,727775,智冠凱基18購01
,,727776,廣明凱基17購01
,,727777,穩懋凱基16購03
,,727778,穩懋國泰18購01
,,727779,元太群益16購03
,,727780,合晶群益17購05
,,727781,良維群益18購01
,,727782,金居群益16購03
,,727783,茂迪群益18購01
,,727784,創惟群益16購01
,,727785,群聯群益16購04
,,727786,智冠麥證16購02
,,727787,廣明麥證16購01
,,727788,智冠中信16購01
,,727789,廣明中信18購01
,,727790,M31元大16購01
,,727791,元太元大18購02
,,727792,合晶元大16購08
,,727793,均豪元大16購01
,,727794,茂迪元大16購03
,,727795,家登元大18購02
,,727796,博智元大18購01
,,727797,晶焱元大16購05
,,727798,智冠元大17購01
,,727799,鈦昇元大17購01
,,727800,榮剛元大16購01
,,727801,精星元大16購01
,,727802,廣明元大17購01
,,727803,穩懋元大17購06
,,727804,大國鋼永豐16購01
,,727805,中美晶永豐16購02
,,727806,伍豐永豐16購01
,,727807,漢磊永豐16購03
,,727808,博智富邦1A購01
,,727809,廣明富邦17購01
,,727810,家登兆豐18購01
,,727811,穩懋兆豐17購01
,,727812,力旺國票17購01
,,727813,中菲行國票16購01
,,727814,中菲行國票17購01
,,727815,亞信國票17購01
,,727816,胡連國票17購01
,,727817,晶焱國票16購02
,,727818,鈺太國票16購01
,,727819,元太統一18購04
,,727820,元太統一1A購01
,,727821,亞信統一17購01
,,727822,穩懋統一18購01
,,727823,中美晶日盛16購01
,,727824,元太日盛16購01
,,727825,力旺元大16購02
,,727826,中美晶元大16購08
,,727827,中美晶元大16購09
,,727828,中美晶元大19購03
,,727829,元太元大16購10
,,727830,亞信元大16購02
,,727831,東捷元大18購01
,,727832,崧騰元大18購01
,,727833,群聯元大16購15
,,727834,穩懋元大16購05
,,727835,中菲行麥證17購02
,,727836,元太麥證17購02
,,727837,亞信麥證16購01
,,727838,廣運麥證16購01
,,727839,宏捷科康和17購01
,,727840,宏捷科康和18購01
,,727841,創惟康和16購01
,,727842,創惟康和17購01
,,727843,創惟康和18購03
,,727844,頎邦康和18購01
,,727845,中美晶凱基18購02
,,727846,中菲行凱基18購02
,,727847,元太凱基18購01
,,727848,台半凱基17購01
,,727849,合晶凱基16購06
,,727850,亞信凱基16購02
,,727851,胡連凱基17購01
,,727852,順達凱基16購01
,,727853,群聯凱基16購07
,,727854,宏捷科富邦18購01
,,727855,亞信富邦1A購01
,,727856,漢磊台新16購01
,,727857,元太中信16購02
,,727858,光頡中信18購01
,,727859,亞信中信16購01
,,727860,璟德中信17購01
,,727861,璟德中信18購01
,,727862,91APP*永豐16購02
,,727863,亞信永豐16購01
,,727864,佳邦永豐16購01
,,727865,家登永豐16購03
,,727866,智冠永豐16購01
,,727867,聚積永豐16購03
,,727868,撼訊永豐16購01
,,727869,亞信國泰18購01
,,727870,萬泰科國泰18購02
,,727871,中菲行群益16購04
,,727872,伍豐群益16購01
,,727873,亞信群益16購01
,,727874,振曜群益16購02
,,727875,創惟群益16購02
,,727876,中美晶國票17購03
,,727877,台半國票17購01
,,727878,宏觀國票17購01
,,727879,美琪瑪國票17購03
,,727880,鈺太國票17購01
,,727881,穩懋國票17購03
,,727882,中美晶凱基16購08
,,727883,禾瑞亞凱基17購01
,,727884,長科*凱基18購01
,,727885,崧騰凱基17購01
,,727886,鈺太凱基17購01
,,727887,宏觀元富16購01
,,727888,宏觀元富16購02
,,727889,宏觀元富19購01
,,727890,胡連元富19購01
,,727891,璟德元富19購01
,,727892,優群元富16購01
,,727893,宏觀國泰18購01
,,727894,大宇資統一19購01
,,727895,元太統一18購05
,,727896,宏觀統一16購01
,,727897,宏觀統一1A購01
,,727898,宏觀統一1A購02
,,727899,宏觀統一1B購01
,,727900,宏觀統一1C購01
,,727901,大宇資元大19購02
,,727902,伍豐元大16購01
,,727903,宇峻元大16購01
,,727904,宏觀元大16購01
,,727905,宏觀元大18購01
,,727906,泰博元大18購01
,,727907,鈊象元大1A購01
,,727908,鈦昇元大16購02
,,727909,瑞基元大16購02
,,727910,群聯元大1A購01
,,727911,榮剛元大16購02
,,727912,漢磊元大16購08
,,727913,廣明元大17購02
,,727914,廣運元大16購01
,,727915,光頡群益1A購01
,,727916,威剛群益19購01
,,727917,家登群益18購01
,,727918,鈊象群益16購03
,,727919,漢磊群益18購02
,,727920,聚和群益16購01
,,727921,中美晶中信16購03
,,727922,伍豐中信16購01
,,727923,家登中信17購01
,,727924,漢磊中信18購01
,,727925,宏觀永豐16購01
,,727926,宏觀永豐16購02
,,727927,宏觀永豐16購03
,,727928,鈦昇永豐16購01
,,727929,智冠國票17購02
,,727930,聚積國票17購03
,,727931,大宇資統一1A購01
,,727932,伍豐統一16購01
,,727933,智冠統一1B購02
,,727934,驊訊統一19購01
,,727935,穩懋日盛16購02
,,727936,大國鋼凱基16購01
,,727937,元太凱基16購06
,,727938,伍豐凱基16購01
,,727939,宏觀凱基16購01
,,727940,昇佳電凱基16購02
,,727941,美琪瑪凱基17購03
,,727942,智冠凱基17購01
,,727943,鈊象凱基16購04
,,727944,廣運凱基16購01
,,727945,創惟國泰18購03
,,727946,碩禾國泰18購01
,,727947,創惟麥證16購01
,,727948,鈊象麥證16購01
,,727949,九暘元大16購01
,,727950,中菲行元大18購01
,,727951,元太元大16購12
,,727952,旺矽元大16購03
,,727953,茂迪元大17購02
,,727954,智冠元大16購01
,,727955,智冠元大18購01
,,727956,頎邦元大16購06
,,727957,頎邦元大18購01
,,727958,漢磊元大18購02
,,727959,廣明元大16購02
,,727960,穩懋元大16購06
,,727961,大宇資群益18購01
,,727962,宇峻群益18購01
,,727963,宏觀群益17購01
,,727964,宏觀群益18購01
,,727965,長科*群益16購01
,,727966,智冠群益17購01
,,727967,智冠群益19購01
,,727968,智冠群益1A購01
,,727969,宏觀中信16購01
,,727970,良維中信17購01
,,727971,長聖中信18購01
,,727972,寶雅中信16購01
,,727973,台半永豐16購02
,,727974,茂達永豐16購03
,,727975,益安永豐16購02
,,727976,智冠永豐16購02
,,727977,崧騰國票17購01
,,727978,群聯國票17購02
,,727979,優群國票17購02
,,727980,大國鋼統一18購01
,,727981,昇佳電統一17購01
,,727982,智冠統一17購01
,,727983,閎康統一18購01
,,727984,閎康統一19購01
,,727985,寶雅統一16購01
,,727986,宇峻國泰18購01
,,727987,智冠國泰18購01
,,727988,鈊象國泰18購01
,,727989,鈊象國泰18購02
,,727990,茂迪群益19購01
,,727991,統振群益17購01
,,727992,璟德群益16購01
,,727993,優群群益17購01
,,727994,群聯日盛16購02
,,727995,元太元大16購13
,,727996,元太元大17購04
,,727997,光頡元大1A購01
,,727998,宇峻元大16購02
,,727999,佳邦元大16購03
,,728000,家登元大16購05
,,728001,璟德元大16購01
,,728002,長聖凱基16購02
,,728003,美琪瑪凱基17購04
,,728004,神盾凱基16購01
,,728005,群聯凱基16購08
,,728006,漢磊凱基16購06
,,728007,璟德凱基16購01
,,728008,優群富邦17購01
,,728009,智冠麥證16購03
,,728010,寶雅麥證16購01
,,728011,伍豐元富16購01
,,728012,伍豐元富16購02
,,728013,伍豐元富19購01
,,728014,同致元富16購01
,,728015,鈺太元富16購02
,,728016,璟德元富19購02
,,728017,神盾中信17購01
,,728018,神盾中信18購01
,,728019,力致永豐16購03
,,728020,宜特永豐16購01
,,728021,朋程永豐16購02
,,728022,金居永豐16購01
,,728023,神盾永豐16購01
,,728024,崧騰永豐16購01
,,728025,精測永豐16購01
,,728026,寶雅永豐16購01
,,728027,合晶日盛16購01
,,728028,朋程國票16購02
,,728029,寶雅國票17購01
,,728030,宏觀統一16購02
,,728031,金居統一19購01
,,728032,金居統一1A購01
,,728033,崧騰統一1B購01
,,728034,智冠統一1A購02
,,728035,群聯統一1C購01
,,728036,雙鴻統一19購02
,,728037,中美晶元大16購11
,,728038,元太元大16購14
,,728039,宏觀元大16購02
,,728040,長科*元大16購03
,,728041,信驊元大16購05
,,728042,胡連元大18購01
,,728043,茂迪元大16購04
,,728044,崧騰元大16購01
,,728045,智冠元大16購02
,,728046,群聯元大16購16
,,728047,群聯元大16購17
,,728048,群聯元大1A購02
,,728049,穩懋元大16購07
,,728050,凡甲凱基16購01
,,728051,中美晶凱基19購02
,,728052,日揚凱基16購01
,,728053,金居凱基16購03
,,728054,宣德凱基17購01
,,728055,崧騰凱基16購01
,,728056,群聯凱基17購05
,,728057,優群凱基16購01
,,728058,優群凱基1A購01
,,728059,聖暉麥證17購01
,,728060,群聯富邦19購01
,,728061,力致群益16購01
,,728062,台半群益18購01
,,728063,朋程群益17購01
,,728064,杰力群益16購02
,,728065,統振群益16購03
,,728066,順達群益17購01
,,728067,群聯群益16購05
,,728068,寶雅群益18購01
,,728069,M31元富19購02
,,728070,大學光元富16購01
,,728071,旺矽元富19購01
,,728072,富喬元富16購01
,,728073,聚積兆豐18購01
,,728074,大國鋼中信16購01
,,728075,聖暉中信16購02
,,728076,優群中信16購01
,,728077,力旺永豐16購02
,,728078,凡甲永豐16購02
,,728079,六角永豐16購01
,,728080,紘康永豐16購01
,,728081,崧騰永豐16購02
,,728082,聖暉永豐16購01
,,728083,優群永豐16購03
,,728084,中美晶兆豐18購01
,,728085,群聯兆豐18購02
,,728086,元太康和19購01
,,728087,旺矽康和18購01
,,728088,凡甲凱基17購01
,,728089,大江凱基17購01
,,728090,合晶凱基17購05
,,728091,欣銓凱基16購01
,,728092,聖暉凱基17購01
,,728093,聖暉凱基1A購01
,,728094,寶雅凱基1A購01
,,728095,中美晶元大18購02
,,728096,伍豐元大18購01
,,728097,崧騰元大18購02
,,728098,鈊象元大16購02
,,728099,優群元大17購01
,,728100,優群元大18購01
,,728101,雙鴻元大16購03
,,728102,寶雅元大16購01
,,728103,久元元富19購01
,,728104,中美晶元富19購02
,,728105,中美晶元富19購03
,,728106,明安元富19購01
,,728107,欣銓元富19購01
,,728108,海韻電元富19購01
,,728109,神盾元富19購01
,,728110,閎康元富19購01
,,728111,力致富邦18購01
,,728112,頎邦富邦18購01
,,728113,凡甲國泰18購01
,,728114,中美晶國泰18購03
,,728115,崧騰群益16購02
,,728116,鈦昇群益16購01
,,728117,聖暉群益16購01
,,728118,雍智群益16購02
,,728119,優群群益16購02
,,728120,力旺統一17購03
,,728121,宏觀統一1C購02
,,728122,益安統一1A購01
,,728123,益安統一1A購02
,,728124,群聯統一18購03
,,728125,雍智統一16購03
,,728126,禾瑞亞中信16購01
,,728127,茂達中信16購01
,,728128,智冠中信17購01
,,728129,宏捷科永豐16購01
,,728130,宏觀永豐16購04
,,728131,金居永豐16購02
,,728132,威剛永豐16購02
,,728133,益安永豐16購03
,,728134,晟德永豐16購01
,,728135,富喬永豐16購01
,,728136,璟德永豐16購01
,,728137,合晶國泰18購03
,,728138,晶焱國泰18購02
,,728139,中美晶統一18購04
,,728140,元太統一19購01
,,728141,元太統一19購02
,,728142,同致統一18購02
,,728143,金居統一18購01
,,728144,博智統一19購01
,,728145,富喬統一19購01
,,728146,晶焱統一18購02
,,728147,金居元富16購02
,,728148,紘康元富16購02
,,728149,博智元富19購01
,,728150,聚和元富16購01
,,728151,漢磊康和16購01
,,728152,漢磊康和18購01
,,728153,元太凱基17購05
,,728154,台半凱基18購02
,,728155,台燿凱基18購02
,,728156,立敦凱基18購01
,,728157,朋程凱基18購02
,,728158,茂達凱基17購02
,,728159,鈊象凱基18購02
,,728160,碩禾凱基17購02
,,728161,廣明凱基16購02
,,728162,廣運凱基16購02
,,728163,雙鴻凱基1A購02
,,728164,元太群益16購04
,,728165,美琪瑪群益16購04
,,728166,家登群益16購02
,,728167,崧騰群益17購01
,,728168,點序群益18購01
,,728169,雙鴻群益18購01
,,728170,撼訊日盛16購01
,,728171,中美晶元大16購12
,,728172,中美晶元大18購03
,,728173,同致元大16購03
,,728174,合晶元大17購07
,,728175,宏觀元大16購03
,,728176,旺矽元大1A購01
,,728177,朋程元大18購01
,,728178,威剛元大18購01
,,728179,倉和元大1A購01
,,728180,崧騰元大1A購01
,,728181,鈊象元大16購03
,,728182,鈊象元大16購04
,,728183,鈊象元大18購01
,,728184,聖暉元大16購02
,,728185,聚和元大16購03
,,728186,驊訊元大16購03
,,728187,元太富邦18購03
,,728188,同致富邦17購01
,,728189,原相富邦18購01
,,728190,振曜富邦17購01
,,728191,穩懋富邦1C購01
,,728192,良維中信18購01
,,728193,智擎中信1A購01
,,728194,聖暉中信16購03
,,728195,M31永豐16購01
,,728196,九暘永豐16購02
,,728197,立端永豐16購01
,,728198,良維永豐16購02
,,728199,亞昕永豐17購01
,,728200,宣德永豐16購01
,,728201,茂達永豐16購04
,,728202,振曜永豐16購01
,,728203,崧騰永豐17購01
,,728204,博智永豐16購02
,,728205,頎邦永豐16購01
,,728206,精星永豐16購02
,,728207,聚和永豐17購01
,,728208,磐亞永豐16購01
,,728209,台半日盛16購01
,,728210,東捷國票17購01
,,728211,聖暉國票16購01
,,728212,聖暉國票17購01
,,728213,聖暉國票19購01
,,728214,璟德國票17購01
,,728215,群聯統一18購04
,,728216,網家統一18購01
,,728217,驊訊統一19購02
,,728218,世界元富16購01
,,728219,聚和元富19購01
,,728220,精星兆豐18購01
,,728221,同致凱基17購01
,,728222,宜鼎凱基16購01
,,728223,鈦昇凱基18購02
,,728224,頎邦凱基18購01
,,728225,精測凱基17購01
,,728226,廣明凱基17購02
,,728227,中美晶國泰18購04
,,728228,聖暉國泰18購01
,,728229,凡甲群益16購03
,,728230,中美晶群益16購05
,,728231,胡連群益17購01
,,728232,倉和群益18購02
,,728233,家登群益16購03
,,728234,晶焱群益1C購01
,,728235,晶焱群益1C購02
,,728236,雙鴻群益16購01
,,728237,九暘元大18購01
,,728238,中美晶元大19購04
,,728239,伍豐元大17購01
,,728240,合晶元大16購09
,,728241,宏觀元大16購04
,,728242,朋程元大1A購01
,,728243,杰力元大16購02
,,728244,美琪瑪元大18購03
,,728245,茂達元大16購05
,,728246,能率元大16購01
,,728247,湧德元大16購02
,,728248,湧德元大18購01
,,728249,群聯元大19購02
,,728250,聖暉元大16購03
,,728251,碩禾元大16購02
,,728252,聚積元大17購01
,,728253,寶雅元大18購01
,,728254,寶雅元大1A購01
,,728255,九暘富邦1A購01
,,728256,宏觀富邦17購01
,,728257,威剛富邦19購01
,,728258,撼訊富邦1A購01
,,728259,元太中信16購04
,,728260,台燿中信18購01
,,728261,博智中信16購01
,,728262,聖暉中信18購01
,,728263,精華中信18購01
,,728264,禾瑞亞永豐16購01
,,728265,朋程永豐16購03
,,728266,朋億永豐17購01
,,728267,建榮永豐17購01
,,728268,桂盟永豐17購01
,,728269,廣明永豐16購03
,,728270,數字永豐16購01
,,728271,朋程日盛17購01
,,728272,M31統一19購01
,,728273,中光電統一19購02
,,728274,中美晶統一19購01
,,728275,元太統一19購03
,,728276,元太統一19購04
,,728277,宏觀統一19購01
,,728278,聚和統一19購01
,,728279,撼訊統一18購02
,,728280,璟德統一19購01
,,728281,點序統一21購01
,,728282,中美晶凱基1A購01
,,728283,伍豐凱基18購02
,,728284,宏觀凱基19購01
,,728285,亞信凱基18購01
,,728286,佳邦凱基17購01
,,728287,旺矽凱基17購01
,,728288,茂達凱基19購01
,,728289,能率凱基19購01
,,728290,雍智凱基17購01
,,728291,璟德凱基19購01
,,728292,寶雅凱基19購01
,,728293,大江富邦19購01
,,728294,中美晶富邦19購01
,,728295,群聯富邦17購02
,,728296,驊訊富邦1B購01
,,728297,聖暉元富17購01
,,728298,精材元富1A購01
,,728299,力旺康和17購01
,,728300,聖暉康和17購01
,,728301,佳邦群益17購01
,,728302,金居群益17購01
,,728303,倉和群益18購03
,,728304,家登群益18購02
,,728305,聖暉群益19購01
,,728306,精材群益17購01
,,728307,寶雅麥證1A購01
,,728308,元太元大17購05
,,728309,台半元大19購02
,,728310,合晶元大17購08
,,728311,智冠元大18購02
,,728312,漢磊元大17購03
,,728313,類比科元大18購01
,,728314,元太中信1A購01
,,728315,亞信中信19購01
,,728316,宣德中信18購01
,,728317,宣德中信19購01
,,728318,精材中信18購01
,,728319,精材中信19購01
,,728320,精測中信18購01
,,728321,精測中信19購01
,,728322,日揚永豐17購01
,,728323,亞信永豐17購01
,,728324,亞泰永豐17購01
,,728325,旺矽永豐17購01
,,728326,東隆興永豐17購01
,,728327,皇田永豐17購01
,,728328,崇越電永豐17購01
,,728329,華研永豐17購01
,,728330,瑞基永豐17購01
,,728331,精材永豐17購01
,,728332,精測永豐17購01
,,728333,廣運永豐17購01
,,728334,雙鴻永豐17購01
,,728335,鈦昇國泰19購01
,,728336,廣運國泰19購01
,,728337,日揚國票18購01
,,728338,合晶國票18購03
,,728339,晶焱國票18購01
,,728340,漢磊國票17購01
,,728341,精材國票19購01
,,728342,廣運國票18購01
,,728343,亞信統一17購02
,,728344,朋程統一19購01
,,728345,宣德統一1B購01
,,728346,美琪瑪統一18購01
,,728347,精材統一18購01
,,728348,精材統一19購01
,,728349,廣明統一1B購01
,,728350,撼訊統一19購01
,,728351,中美晶元富17購03
,,728352,元太元富17購02
,,728353,元太元富17購03
,,728354,茂迪元富1A購01
,,728355,萬潤元富17購01
,,728356,群聯元富17購04
,,728357,群聯元富17購05
,,728358,寶雅元富17購01
,,728359,寶雅元富17購02
,,728360,力致群益17購02
,,728361,宏捷科群益18購01
,,728362,旺矽群益18購01
,,728363,信音群益19購01
,,728364,聖暉群益1A購01
,,728365,漢磊群益17購05
,,728366,加高富邦18購01
,,728367,欣銓富邦18購01
,,728368,穩懋富邦19購01
,,728369,日揚凱基19購01
,,728370,台半凱基19購01
,,728371,佳邦凱基1B購01
,,728372,杰力凱基18購01
,,728373,桂盟凱基1B購01
,,728374,富喬凱基17購01
,,728375,萬潤凱基19購01
,,728376,群聯凱基1B購02
,,728377,漢磊凱基19購03
,,728378,雙鴻凱基19購01
,,728379,長科*中信17購01
,,728380,日揚永豐17購02
,,728381,加高永豐17購01
,,728382,亞信永豐17購02
,,728383,昇佳電永豐17購01
,,728384,金山電永豐17購01
,,728385,長聖永豐17購01
,,728386,建榮永豐17購02
,,728387,智擎永豐17購01
,,728388,閎康永豐17購01
,,728389,群聯永豐17購01
,,728390,聖暉永豐17購01
,,728391,漢磊永豐17購02
,,728392,凡甲元大18購02
,,728393,凡甲元大1B購01
,,728394,大中元大17購01
,,728395,中美晶元大1B購01
,,728396,日揚元大18購01
,,728397,日揚元大19購01
,,728398,加高元大17購01
,,728399,宏觀元大18購02
,,728400,昇佳電元大1B購01
,,728401,金居元大17購04
,,728402,威剛元大17購03
,,728403,威剛元大17購04
,,728404,倉和元大1B購01
,,728405,晶焱元大17購04
,,728406,聖暉元大19購01
,,728407,精星元大17購02
,,728408,精測元大1B購01
,,728409,聚和元大19購02
,,728410,廣運元大1A購01
,,728411,璟德元大17購02
,,728412,91APP*凱基18購01
,,728413,日揚凱基18購01
,,728414,加高凱基18購01
,,728415,弘塑凱基17購01
,,728416,宏捷科凱基17購02
,,728417,朋程凱基19購01
,,728418,長科*凱基19購01
,,728419,威剛凱基19購01
,,728420,原相凱基18購01
,,728421,閎康凱基17購02
