part,5
name,上櫃認購(售)權證
,,70014P,中美晶兆豐14售01
,,70018P,合晶元富15售03
,,70019P,威剛元富15售03
,,70026P,大江元富15售02
,,70035P,群聯元富15售04
,,70060P,原相群益14售01
,,70061P,精材群益14售01
,,70062P,精材群益15售02
,,70074P,合晶元富15售05
,,70082P,朋程國票15售01
,,70108P,力旺群益15售02
,,70114P,威剛國泰15售01
,,70118P,台半群益14售02
,,70121P,合晶元富16售02
,,70122P,元太國票14售01
,,70130P,力旺群益14售02
,,70131P,世界群益14售01
,,70134P,力旺中信15售02
,,70141P,精測元富14售03
,,70149P,M31國票14售02
,,70153P,力旺元富16售04
,,70155P,合晶元富16售05
,,70158P,力旺統一15售03
,,70159P,博智元富15售01
,,70175P,元太群益16售01
,,70185P,金居凱基14售01
,,70186P,鈊象凱基14售01
,,70187P,力旺國票15售01
,,70188P,驊訊國票14售02
,,70189P,力旺元大14售04
,,70190P,元太元大14售04
,,70191P,湧德元大14售01
,,70192P,聯亞中信14售01
,,70193P,神盾凱基14售01
,,70194P,漢磊凱基14售03
,,70195P,精測凱基14售01
,,70196P,美琪瑪國票14售01
,,70197P,閎康國票14售01
,,70198P,M31元富14售02
,,70199P,湧德群益14售01
,,70200P,漢磊群益14售03
,,70201P,力旺統一14售05
,,70202P,力旺中信17售01
,,70203P,力旺國泰16售01
,,70204P,力旺元大14售05
,,70205P,力旺凱基15售03
,,70206P,朋程凱基14售03
,,70207P,力旺群益14售04
,,70208P,群聯元大14售03
,,70209P,力旺國票14售03
,,70210P,力旺元大14售06
,,70211P,宏捷科群益14售01
,,70212P,威剛群益14售02
,,70213P,驊訊凱基14售03
,,70214P,鈺太國票14售02
,,70215P,精華國票15售02
,,70216P,璟德國票15售02
,,70217P,威剛元富17售01
,,70218P,群聯元富17售03
,,70219P,信驊凱基14售02
,,70220P,鈺創凱基14售06
,,70221P,世界元大14售04
,,70222P,合晶元大14售04
,,70223P,朋程元大14售04
,,70224P,鈺創群益14售04
,,70225P,信驊元大14售03
,,70226P,聚和元大14售01
,,70227P,合晶群益15售02
,,70228P,旺矽群益14售04
,,70229P,茂達國票15售02
,,70230P,撼訊國票15售02
,,70231P,力旺凱基14售02
,,70232P,朋程國票15售03
,,70233P,點序國票14售02
,,70234P,台半凱基14售05
,,70235P,碩禾凱基14售02
,,70236P,鈊象元富17售03
,,70237P,驊訊國票15售02
,,70238P,台半元大14售04
,,70239P,亞信元富14售02
,,70240P,晶焱元大15售02
,,70241P,力旺元富15售01
,,70242P,晶焱元富15售02
,,70243P,晶焱國票15售03
,,70244P,晶焱凱基15售03
,,70245P,精測元富15售02
,,70246P,穩懋元富15售02
,,70247P,晶焱中信15售02
,,70248P,朋程群益15售03
,,70249P,統振群益16售02
,,70250P,元太元富15售01
,,70251P,台半康和15售01
,,70252P,璟德凱基15售02
,,70253P,朋程元大15售03
,,70254P,朋程元富18售01
,,70255P,聯亞元富15售01
,,70256P,精測中信16售02
,,70257P,精測國票16售01
,,70258P,世界凱基15售03
,,70259P,朋程元富18售02
,,70260P,元太元大15售03
,,70261P,精測元大15售06
,,70262P,中光電康和15售01
,,70263P,力旺元大15售03
,,70264P,長科*元大15售03
,,70265P,創惟元大15售02
,,70266P,創惟元大16售01
,,70267P,世界元富15售03
,,70268P,網家國票16售02
,,70269P,力旺元大15售04
,,70270P,台半元富15售01
,,70271P,朋程元富18售05
,,70272P,中光電康和15售04
,,70273P,中光電台新15售02
,,70274P,中光電中信15售03
,,70275P,中光電國票15售03
,,70276P,漢磊國票15售02
,,70277P,力旺凱基15售06
,,70278P,漢磊群益16售05
,,70279P,信驊元大15售02
,,70280P,漢磊元大15售05
,,70281P,漢磊元大15售06
,,70282P,漢磊元富15售02
,,70283P,中光電康和15售07
,,70284P,漢磊康和15售03
,,70285P,力旺元富15售04
,,70286P,驊訊元富18售01
,,70287P,茂達康和15售03
,,70288P,元太元大15售06
,,70289P,驊訊元大15售01
,,70290P,元太中信15售01
,,70291P,元太凱基15售04
,,70292P,元太康和15售02
,,70293P,元太台新15售01
,,70294P,晶焱國票16售01
,,70295P,漢磊統一15售02
,,70296P,漢磊群益15售05
,,70297P,漢磊群益16售06
,,70298P,漢磊凱基15售05
,,70299P,合晶元富18售03
,,70300P,宏捷科元富15售01
,,70301P,威剛元富18售03
,,70302P,晶焱元富15售03
,,70303P,晶焱元大15售07
,,70304P,元太國票16售02
,,70305P,台半國票16售02
,,70306P,中美晶元富15售02
,,70307P,中美晶元富16售04
,,70308P,元太元富15售02
,,70309P,合晶元富18售06
,,70310P,合晶元富18售07
,,70311P,合晶群益16售05
,,70312P,晶焱群益16售03
,,70313P,中美晶國票16售05
,,70314P,佳邦國票16售02
,,70315P,創惟國票16售04
,,70316P,大學光元大15售02
,,70317P,創惟元大15售07
,,70318P,群聯元富18售03
,,70319P,原相凱基15售01
,,70320P,合晶群益17售03
,,70321P,威剛群益16售01
,,70322P,穩懋中信16售01
,,70323P,元太元大16售04
,,70324P,力旺康和16售02
,,70325P,合晶康和16售01
,,70326P,茂達國票17售01
,,70327P,合晶台新16售01
,,70328P,合晶元大16售06
,,70329P,合晶國票16售03
,,70330P,力旺群益18售01
,,70331P,合晶凱基16售04
,,70332P,穩懋富邦18售01
,,70333P,創惟元富19售01
,,70334P,朋程凱基16售03
,,70335P,群聯元大16售07
,,70336P,美琪瑪國票17售02
,,70337P,信驊凱基16售01
,,70338P,網家凱基16售03
,,70339P,漢磊群益17售04
,,70340P,網家群益16售02
,,70341P,中美晶元富16售05
,,70342P,元太統一16售04
,,70343P,漢磊元大16售06
,,70344P,網家元大16售01
,,70345P,光頡元富16售03
,,70346P,漢磊凱基16售05
,,70347P,茂達元大16售03
,,70348P,茂迪康和16售02
,,70349P,元太元富19售03
,,70350P,元太元富19售04
,,70351P,創惟元富19售02
,,70352P,頎邦元富16售02
,,70353P,櫃200群益16售02
,,70354P,萬泰科國票17售02
,,70355P,萬泰科國票17售05
,,70356P,合晶元大16售07
,,70357P,力旺中信18售02
,,70358P,雙鴻國票17售01
,,70359P,合晶凱基17售04
,,70360P,元太元大16售11
,,70361P,穩懋富邦18售03
,,70362P,中美晶元大16售10
,,70363P,亞信元富16售02
,,70364P,茂迪元富16售03
,,70365P,茂達康和16售02
,,70366P,群聯康和16售03
,,70367P,元太中信16售03
,,70368P,元太國票17售04
,,70369P,元太康和16售02
,,70370P,金居元大16售04
,,70371P,茂達元大16售04
,,70372P,同致元大16售02
,,70373P,合晶中信16售03
,,70374P,力旺元大16售03
,,70375P,力旺元大16售04
,,70376P,網家元大16售02
,,70377P,同致凱基16售01
,,70378P,金居凱基16售02
,,70379P,中美晶富邦18售02
,,70380P,元太富邦18售02
,,70381P,力旺群益16售03
,,70382P,力旺凱基16售04
,,70383P,群聯富邦16售01
,,70384P,群聯群益16售06
,,70385P,台半中信16售01
,,70386P,元太元富19售05
,,70387P,群聯凱基16售09
,,70388P,元太元大16售15
,,70389P,世界富邦16售01
,,70390P,世界元富1A售01
,,70391P,同致元富17售01
,,70392P,美琪瑪元大17售01
,,70393P,群聯元大17售04
,,70394P,璟德凱基17售01
,,70395P,元太中信17售03
,,70396P,合晶元大17售09
,,70397P,美琪瑪國票18售01
,,70398P,中美晶凱基17售05
,,70399P,中美晶康和17售01
,,70400P,創惟國票18售01
,,70401P,群聯群益17售02
,,70402P,元太凱基17售06
,,70403P,穩懋凱基17售02
,,70404P,創惟元大17售05
,,70405P,禾瑞亞國票18售01
,,70406P,群聯國票18售03
,,70407P,茂達凱基17售03
,,70408P,晶焱元大17售05
,,70409P,智冠中信17售03
,,70410P,亞信元大18售03
,,70411P,穩懋元大17售07
,,70412P,茂達群益17售01
,,70413P,光頡元大17售02
,,70414P,晶宏元大17售01
,,70415P,晶宏元大17售04
,,70416P,碩禾元大17售03
,,70417P,宏捷科國票18售01
,,70418P,崧騰國票18售02
,,70419P,穩懋國票18售01
,,70420P,創惟凱基18售03
,,70421P,晶焱群益17售01
,,70422P,穩懋元大17售08
,,70423P,美琪瑪凱基17售06
,,70424P,驊訊群益17售02
,,70425P,光頡中信17售02
,,70426P,光頡國票18售02
,,70427P,博智國票18售01
,,70428P,神準元富17售02
,,70429P,合晶凱基17售08
,,70430P,台半群益17售02
,,70431P,宏捷科群益18售02
,,70432P,元太元大17售10
,,70433P,精材元大17售03
,,70434P,元太元富17售07
,,70435P,元太元富17售08
,,70436P,雙鴻凱基17售02
,,70437P,驊訊群益17售03
,,70438P,宏捷科凱基17售04
,,70439P,宏捷科群益17售04
,,70440P,佳邦群益18售01
,,70441P,朋程群益18售01
,,70442P,元太台新18售01
,,70443P,雙鴻群益1A售01
,,70444P,元太元大18售06
,,70445P,雙鴻元大18售03
,,70446P,元太凱基19售03
,,70447P,元太國票19售01
,,70448P,神準元富18售01
,,70449P,元太康和18售02
,,70450P,元太元大18售07
,,70451P,宏捷科元大18售01
,,70452P,家登元大18售04
,,70453P,驊訊元大18售01
,,70454P,合晶國票19售01
,,70455P,元太凱基18售04
,,70456P,中美晶元大18售04
,,70457P,元太元富18售06
,,70458P,家登群益18售04
,,70459P,德微群益18售02
,,70460P,穩懋凱基18售04
,,70461P,驊訊凱基18售02
,,70462P,穩懋國泰1A售01
,,70463P,博智中信18售01
,,70464P,合晶元大1B售01
,,70465P,宏捷科元大18售02
,,70466P,德微元大1C售01
,,70467P,元太元大19售04
,,70468P,博智元大18售02
,,70469P,元太群益18售05
,,70470P,聖暉群益1A售02
,,70471P,晶宏群益18售02
,,70472P,群聯群益18售04
,,70473P,驊訊元大18售02
,,70474P,世界群益18售01
,,70475P,茂達國票19售01
,,70476P,元太國泰1A售02
,,70477P,世界凱基18售04
,,70478P,元太元富18售08
,,70479P,元太元富1B售05
,,70480P,元太元大18售12
,,70481P,點序元大18售04
,,70482P,宏捷科元富18售01
,,70483P,優群元富18售01
,,70484P,元太凱基18售07
,,70485P,群聯凱基18售02
,,70486P,凡甲國票19售01
,,70487P,晶宏凱基18售03
,,70488P,元太元大18售17
,,70489P,台半凱基18售03
,,70490P,元太元大18售19
,,70491P,穩懋元大18售02
,,70492P,金居國票1A售01
,,70493P,金麗科群益19售03
,,70494P,雙鴻康和1B售01
,,70495P,鈺創元富19售04
,,70496P,鈺創國票1A售01
,,70497P,碩禾國票1A售01
,,70498P,鈺創元大19售12
,,70499P,鈺創元大19售13
,,70500P,鈺創元大19售14
,,70501P,鈺創凱基19售02
,,70502P,穩懋凱基19售03
,,70503P,鈺創群益1A售02
,,70504P,穩懋富邦1B售01
,,70505P,茂達元大19售05
,,70506P,穩懋國票1A售01
,,70507P,元太康和1B售01
,,70508P,元太元大19售09
,,70509P,穩懋元大19售03
,,70510P,雙鴻凱基1A售04
,,70511P,金麗科凱基19售04
,,70512P,元太富邦1B售04
,,70513P,光頡群益19售02
,,70514P,網家國票1A售02
,,70515P,中美晶元富19售05
,,70516P,朋程元大19售02
,,70517P,精測元大19售01
,,70518P,璟德元大19售01
,,70519P,元太群益19售09
,,70520P,元太國票1A售04
,,70521P,元太凱基19售07
,,70522P,璟德凱基19售04
,,70523P,元太元大19售10
,,70524P,鈺創國泰1B售03
,,70525P,德微群益1A售02
,,70526P,櫃200群益19售02
,,70527P,茂達凱基19售06
,,70528P,德微凱基1A售01
,,70529P,德微元大19售05
,,70530P,鈺創群益1B售03
,,70531P,金麗科國票1A售07
,,70532P,茂達國票1A售04
,,70533P,萬潤國票1A售03
,,70534P,元太中信19售03
,,70535P,元太富邦1B售05
,,70536P,合晶群益19售04
,,70537P,元太統一19售09
,,70538P,亞信國票1A售02
,,70539P,鈊象國票1A售03
,,70540P,撼訊國票1A售01
,,70541P,元太元富19售09
,,70542P,長聖中信19售01
,,70543P,台半元富19售01
,,70544P,合晶凱基1A售05
,,70545P,精測凱基1A售01
,,70546P,茂達國票1B售01
,,70547P,元太國票1B售01
,,70548P,碩禾國票1B售01
,,70549P,點序國票1B售02
,,70550P,德微群益1B售01
,,70551P,雙鴻國票1B售02
,,70552P,穩懋中信1A售01
,,720291,合晶凱基14購01
,,720298,環球晶凱基14購01
,,720420,合晶凱基14購02
,,720466,合晶凱基14購03
,,720631,中美晶第一14購01
,,720673,環球晶凱基14購02
,,720762,威剛凱基14購01
,,720830,群聯凱基15購01
,,720831,中美晶統一15購01
,,720833,群聯統一15購01
,,721008,萬潤統一14購01
,,721106,穩懋第一15購01
,,721117,鈊象凱基15購01
,,721234,精材第一15購01
,,721525,環球晶兆豐14購01
,,721679,穩懋元大14購01
,,721686,穩懋凱基14購01
,,721767,碩禾凱基14購01
,,721865,環球晶元大14購01
,,721980,雙鴻元富16購01
,,721985,環球晶第一16購01
,,722044,環球晶元大15購01
,,722072,廣錠元富17購01
,,722109,碩禾元大15購01
,,722111,雙鴻元大15購01
,,722181,中美晶第一17購01
,,722182,穩懋第一17購01
,,722240,頎邦第一17購01
,,722248,久元群益14購01
,,722262,臺慶科元富14購01
,,722285,台半元大14購01
,,722302,鈺創元富14購01
,,722312,矽瑪元大14購01
,,722315,鈺創元大14購01
,,722340,大宇資群益14購01
,,722356,合晶元富14購01
,,722364,穩懋元大14購03
,,722379,典範群益14購01
,,722461,宣德元富14購01
,,722462,聚積元富14購01
,,722503,凡甲元大14購01
,,722505,加百裕元大14購01
,,722547,同致元大14購01
,,722554,穩懋元大14購04
,,722557,中美晶元富17購01
,,722559,同致元富14購01
,,722562,家登元富14購02
,,722629,創惟元大15購01
,,722634,頎邦元大14購01
,,722643,力旺元富17購01
,,722645,宏捷科元富17購01
,,722712,聖暉元富14購01
,,722721,朋程元大14購01
,,722724,威剛元大14購01
,,722791,譜瑞元大14購01
,,722826,中美晶元大14購01
,,722892,欣銓元大14購01
,,722899,驊訊元大14購02
,,722944,元太元大14購01
,,722950,鈦昇元大15購01
,,722982,久元凱基14購01
,,722985,元太凱基15購01
,,723053,凡甲凱基15購01
,,723058,欣銓凱基15購01
,,723071,臺慶科元大15購01
,,723093,大中元大15購01
,,723097,原相元大16購01
,,723098,聚積元大15購01
,,723123,合晶元富15購01
,,723124,群聯元富15購01
,,723128,鈊象元富15購01
,,723132,合晶元大16購01
,,723139,凡甲凱基15購02
,,723175,同致群益16購01
,,723178,進泰群益15購01
,,723199,安國元大15購01
,,723220,旺矽群益15購01
,,723258,欣銓群益15購01
,,723262,鈊象群益15購01
,,723266,旺矽元大15購01
,,723286,譜瑞富邦15購01
,,723327,鈺創元富15購01
,,723337,長科*元大16購01
,,723342,鈺創元大16購01
,,723343,頎邦元大16購01
,,723349,金居凱基15購01
,,723350,頎邦凱基15購01
,,723352,世界國票14購02
,,723357,台半富邦14購01
,,723358,凡甲統一14購01
,,723360,大田統一14購03
,,723361,元太統一14購02
,,723362,世界統一14購01
,,723363,台半統一14購01
,,723364,台燿統一14購01
,,723365,明安統一14購01
,,723366,泰博統一14購01
,,723368,雙鴻統一14購01
,,723369,雙鴻統一14購02
,,723370,鈺創統一14購01
,,723372,合一國泰14購01
,,723376,世界元大15購01
,,723378,台半元大15購01
,,723381,欣銓元大15購01
,,723396,中美晶元富15購01
,,723397,世界元富15購01
,,723419,頎邦富邦15購01
,,723421,台燿國票14購01
,,723422,同致國票14購01
,,723428,力旺統一14購02
,,723429,凡甲統一14購02
,,723430,凡甲統一14購03
,,723431,中美晶統一14購02
,,723433,世界統一14購02
,,723434,世界統一14購03
,,723435,同致統一14購07
,,723436,同致統一14購08
,,723437,美琪瑪統一14購01
,,723438,美琪瑪統一14購02
,,723439,閎康統一14購01
,,723440,群聯統一14購03
,,723441,群聯統一14購04
,,723442,精材統一14購02
,,723443,昇佳電國泰14購01
,,723444,力旺元大14購01
,,723446,大宇資元大15購01
,,723449,金居元大14購01
,,723451,越峰元大14購01
,,723452,群聯元大14購01
,,723453,群聯元大16購01
,,723456,精測元大14購01
,,723458,晟德元大15購01
,,723459,紘康元大14購01
,,723460,凡甲群益14購01
,,723464,廣錠群益14購01
,,723469,台燿元富15購01
,,723476,台半統一14購02
,,723477,頎邦統一14購01
,,723497,鈺太凱基14購01
,,723498,崧騰群益14購01
,,723500,原相國泰14購01
,,723502,世界元大14購01
,,723506,亞泰元大14購01
,,723507,昇佳電元大15購01
,,723509,金居元大16購01
,,723513,頎邦元大14購02
,,723518,合晶元富15購02
,,723519,威剛元富15購01
,,723520,威剛元富15購02
,,723521,閎康元富15購01
,,723524,昇佳電兆豐14購01
,,723525,金居兆豐14購01
,,723532,精華富邦14購01
,,723543,長科*國泰14購01
,,723544,美琪瑪國泰14購01
,,723545,聚積國泰14購02
,,723547,尼克森群益16購01
,,723549,捷迅群益14購01
,,723552,泰博元富15購01
,,723553,群聯元富15購02
,,723555,金居兆豐14購02
,,723566,新普元大14購01
,,723569,頎邦元大14購03
,,723570,世界統一14購04
,,723571,朋程統一14購01
,,723572,美琪瑪統一14購03
,,723574,驊訊統一14購01
,,723575,世界國票14購03
,,723588,宏捷科富邦14購01
,,723589,群聯富邦14購01
,,723591,大江元富15購01
,,723592,世界元富18購01
,,723593,尼克森群益14購01
,,723595,廣運群益15購01
,,723596,中菲行元大15購01
,,723604,鈊象元大14購01
,,723605,鈊象元大14購02
,,723609,頎邦中信14購01
,,723619,中菲行統一14購03
,,723620,智崴統一14購01
,,723625,尼克森富邦14購01
,,723629,美琪瑪元大15購01
,,723630,神盾元大14購01
,,723632,雙鴻元大15購02
,,723633,美琪瑪國泰14購02
,,723634,富喬國泰14購01
,,723637,明安群益14購01
,,723639,精華群益18購01
,,723641,群聯元富15購03
,,723646,世界凱基14購01
,,723652,光頡元大14購01
,,723653,欣銓元大14購02
,,723658,聚積元大14購01
,,723660,威剛國泰14購01
,,723661,新普國泰14購01
,,723663,威剛統一14購03
,,723664,威剛統一15購01
,,723666,萬潤統一14購02
,,723667,萬潤統一14購03
,,723669,精材統一15購01
,,723671,鈊象統一14購03
,,723695,凡甲統一15購01
,,723696,同致統一14購09
,,723708,禾瑞亞元大14購02
,,723712,碩禾元大14購01
,,723716,威剛兆豐14購01
,,723723,旺矽統一14購05
,,723724,雙鴻統一14購03
,,723725,頎邦統一14購02
,,723733,鈊象富邦14購01
,,723734,頎邦富邦14購01
,,723738,智崴群益14購01
,,723739,晟德群益15購01
,,723745,朋程元富15購01
,,723758,旺矽統一14購06
,,723762,穩懋富邦14購01
,,723765,威剛元富15購04
,,723767,中菲行國泰14購01
,,723768,元太國泰14購02
,,723769,金居國泰14購01
,,723770,群聯國泰14購02
,,723771,精材國泰14購01
,,723772,同致群益15購01
,,723774,原相群益15購01
,,723784,中美晶元大14購02
,,723796,中美晶凱基14購01
,,723797,旺矽凱基14購01
,,723798,昇佳電凱基15購01
,,723801,欣銓凱基14購01
,,723809,雍智統一14購01
,,723810,雍智統一15購01
,,723812,紘康統一14購02
,,723814,鈺創統一14購02
,,723815,鈺創統一14購03
,,723818,精材群益15購01
,,723819,鈊象群益14購01
,,723823,精材元富15購01
,,723827,雙鴻元大15購03
,,723833,台半統一14購03
,,723834,雍智統一15購02
,,723840,長科*國泰14購02
,,723857,中美晶元大14購03
,,723858,中美晶元大14購04
,,723860,旺矽元大15購02
,,723864,晶焱元大14購01
,,723865,晶焱元大16購01
,,723873,鈺創凱基14購02
,,723876,驊訊凱基14購01
,,723877,凡甲統一14購04
,,723878,同致統一14購10
,,723880,朋程統一15購01
,,723881,原相統一14購01
,,723883,世禾元大14購01
,,723888,朋程第一18購01
,,723889,中美晶國泰14購02
,,723890,合晶國泰14購01
,,723891,合晶國泰14購02
,,723892,安國群益14購01
,,723908,群聯凱基17購01
,,723911,富喬兆豐14購02
,,723912,晶焱兆豐14購01
,,723915,勤凱元大14購01
,,723917,精測元大14購02
,,723925,欣銓國泰14購02
,,723943,精星統一14購01
,,723944,精星統一15購01
,,723947,世界凱基14購02
,,723948,宏捷科凱基14購01
,,723950,晶焱凱基14購01
,,723951,晶焱凱基16購01
,,723952,力旺元大14購02
,,723954,中美晶元大16購01
,,723955,合晶元大16購02
,,723957,宏捷科元大16購01
,,723958,長科*元大14購01
,,723961,朋程國泰14購01
,,723962,雍智國泰14購01
,,723963,鈦昇國泰14購01
,,723971,欣銓元富15購01
,,723972,胡連元富15購01
,,723973,鈊象元富15購02
,,723997,中美晶統一15購02
,,724000,合晶統一15購01
,,724001,朋程統一15購02
,,724003,雍智統一15購03
,,724005,台半國泰15購01
,,724006,合晶國泰15購01
,,724007,宏捷科國泰15購01
,,724008,力旺群益15購01
,,724011,宏捷科群益15購01
,,724013,力旺凱基15購01
,,724016,合晶元富15購04
,,724018,原相元富15購01
,,724019,原相元富15購02
,,724020,萬潤元富15購01
,,724021,群聯元富15購05
,,724026,精材兆豐15購01
,,724034,大樹元大15購01
,,724035,大樹元大16購01
,,724038,世界元大16購01
,,724041,朋程元大16購01
,,724047,鈺創元大16購02
,,724051,力旺統一15購01
,,724053,凡甲統一15購02
,,724057,欣銓統一15購01
,,724061,欣銓國泰15購01
,,724071,欣銓群益15購02
,,724075,中菲行元富15購01
,,724077,欣銓凱基15購02
,,724082,鈊象凱基15購02
,,724083,頎邦凱基15購02
,,724085,台半元大15購02
,,724087,合晶元大16購03
,,724090,金居元大15購01
,,724093,萬潤元大15購01
,,724094,環球晶元大18購01
,,724097,頎邦元大16購02
,,724108,中美晶統一15購03
,,724113,環球晶統一15購01
,,724114,晶焱國泰15購01
,,724115,頎邦國泰15購01
,,724118,長科*群益15購01
,,724119,力旺凱基16購01
,,724120,中美晶凱基15購01
,,724121,元太凱基15購02
,,724123,合晶凱基15購01
,,724126,環球晶凱基17購01
,,724130,中美晶元大17購01
,,724133,元太元大15購01
,,724138,杰力元大15購01
,,724139,欣銓元大17購01
,,724142,環球晶元大15購02
,,724166,朋程富邦15購01
,,724171,原相統一15購01
,,724174,雍智統一16購01
,,724175,驊訊統一15購01
,,724176,凡甲元富16購01
,,724184,中菲行元大17購01
,,724186,環球晶元大17購01
,,724189,鈊象元大15購01
,,724196,欣銓國泰15購02
,,724203,朋程統一16購01
,,724204,杰力統一16購01
,,724205,長科*統一15購01
,,724207,雙鴻統一15購01
,,724208,鈺創統一15購01
,,724209,宜鼎凱基15購01
,,724211,長科*凱基15購01
,,724214,榮剛凱基15購01
,,724217,雙鴻凱基15購01
,,724223,朋程元大15購01
,,724228,長科*元大15購01
,,724230,環球晶元大19購01
,,724247,佳邦兆豐15購01
,,724250,鈊象兆豐15購01
,,724260,撼訊凱基15購01
,,724262,鈊象凱基15購03
,,724266,元太統一15購01
,,724269,茂達統一16購01
,,724270,茂達統一16購02
,,724273,鈺創統一16購01
,,724274,鈺創統一16購02
,,724278,晶焱國泰15購02
,,724279,鈊象國泰15購01
,,724288,元太元大17購01
,,724289,昇佳電元大15購02
,,724290,越峰元大15購01
,,724291,越峰元大16購01
,,724293,群聯元大15購01
,,724294,群聯元大17購01
,,724299,撼訊元大17購01
,,724301,威剛元富16購01
,,724302,群聯元富16購01
,,724304,雙鴻元富16購02
,,724305,鈊象元富16購01
,,724308,撼訊康和16購01
,,724325,大田統一15購01
,,724326,大江統一15購01
,,724327,旺矽統一16購01
,,724329,茂達統一15購01
,,724330,茂達統一15購02
,,724331,萬潤統一15購01
,,724332,群聯統一15購02
,,724333,碩禾統一16購01
,,724334,撼訊統一16購01
,,724335,撼訊統一16購02
,,724336,紘康統一16購01
,,724337,朋程元富16購01
,,724338,穩懋元富16購01
,,724339,紘康元富16購01
,,724343,中美晶國泰15購01
,,724344,旺矽國泰15購01
,,724345,鈺創國泰15購01
,,724346,鈺創國泰15購02
,,724348,世界群益17購01
,,724350,瑞基群益15購01
,,724354,世界凱基17購01
,,724360,環球晶凱基15購01
,,724366,世界元大17購01
,,724375,環球晶元大17購02
,,724376,頎邦第一19購01
,,724390,大宇資凱基16購01
,,724392,宣德凱基15購01
,,724397,世界統一16購01
,,724398,晶焱統一15購01
,,724399,撼訊統一15購01
,,724402,頎邦統一15購01
,,724403,世界康和19購01
,,724404,鈺創國泰15購03
,,724413,環球晶富邦15購01
,,724414,凡甲元大15購01
,,724415,大國鋼元大17購01
,,724420,鈺創元大15購01
,,724421,晶焱兆豐15購01
,,724423,旺矽元大15購03
,,724424,晶焱元大14購02
,,724425,晶焱元大14購03
,,724428,大田國票14購01
,,724429,久元統一14購01
,,724430,大國鋼統一14購03
,,724431,晶焱統一15購02
,,724432,晶焱統一16購01
,,724433,瑞基統一15購01
,,724434,大國鋼麥證14購01
,,724435,久元凱基14購02
,,724438,世界凱基14購03
,,724439,茂達凱基14購02
,,724442,網家凱基14購01
,,724443,頎邦凱基14購01
,,724445,威剛富邦15購01
,,724446,精材富邦15購01
,,724454,安國群益16購01
,,724457,晶焱群益14購01
,,724459,鈺創群益14購02
,,724460,大國鋼國票14購01
,,724461,台半國票14購02
,,724462,禾瑞亞國票14購02
,,724463,旺矽國票14購01
,,724464,威剛國票14購02
,,724465,瑞基國票14購02
,,724466,萬潤國票14購01
,,724467,精材國票14購01
,,724468,穩懋國票14購01
,,724470,碩禾統一14購02
,,724471,撼訊統一15購02
,,724472,環球晶第一19購01
,,724473,力旺元大14購03
,,724474,力旺元大17購01
,,724475,久元元大14購01
,,724476,大宇資元大19購01
,,724477,泰博元大15購01
,,724485,力旺凱基14購01
,,724486,泰博凱基14購01
,,724487,泰博凱基14購02
,,724488,泰博凱基14購03
,,724489,僑威凱基14購01
,,724490,撼訊凱基14購01
,,724499,力旺元富16購01
,,724501,鈊象元富16購02
,,724502,力旺兆豐15購01
,,724503,世界兆豐15購01
,,724505,力旺國泰15購01
,,724506,群聯國泰15購01
,,724507,網家國泰15購01
,,724508,力旺群益14購01
,,724509,力旺群益16購01
,,724510,久元群益14購02
,,724517,璟德國票14購01
,,724518,元太統一14購03
,,724519,泰博統一14購02
,,724520,泰博統一15購01
,,724521,網家統一14購01
,,724522,旺矽麥證14購01
,,724523,合晶凱基15購02
,,724525,欣銓凱基14購03
,,724527,璟德凱基14購01
,,724528,大江元大15購01
,,724530,世界元大17購02
,,724533,台半元大15購03
,,724534,台半元大16購01
,,724538,原相元大15購01
,,724541,璟德元大15購01
,,724542,長科*國泰15購01
,,724543,宣德國泰15購01
,,724544,晶焱國泰15購03
,,724547,亨泰光群益14購01
,,724553,中美晶富邦15購01
,,724554,欣銓富邦14購01
,,724556,旺矽元富14購01
,,724557,瑞基元富14購01
