part,5
,,725774,晶焱元大15購01
,,725775,晶焱元大17購01
,,725776,晶焱元大19購01
,,725777,雍智元大15購01
,,725778,晶焱國泰18購01
,,725779,力旺元富18購01
,,725780,晶焱元富15購01
,,725781,世界兆豐16購01
,,725782,晶焱兆豐15購02
,,725783,精測兆豐15購01
,,725784,宏捷科康和15購01
,,725785,宏捷科康和15購02
,,725786,世界群益15購01
,,725787,台燿群益15購01
,,725788,信驊群益15購01
,,725789,威剛群益15購01
,,725790,晶焱群益16購01
,,725791,晶焱群益16購02
,,725792,雍智群益15購01
,,725793,力旺凱基15購04
,,725794,力旺凱基15購05
,,725795,弘塑凱基15購01
,,725796,宏捷科凱基15購01
,,725797,佳邦凱基15購01
,,725798,昇佳電凱基15購02
,,725799,昇達科凱基15購02
,,725800,信驊凱基15購01
,,725801,紘康凱基15購02
,,725802,晶焱凱基15購01
,,725803,晶焱凱基15購02
,,725804,精星凱基15購01
,,725805,穩懋凱基15購01
,,725806,精星富邦15購01
,,725807,典範國票15購01
,,725808,晶焱國票15購01
,,725809,晶焱國票15購02
,,725810,世界統一15購02
,,725811,宏捷科統一16購02
,,725812,昇達科統一15購02
,,725813,昇達科統一16購01
,,725814,胡連統一15購01
,,725815,晶焱統一15購04
,,725816,晶焱統一15購05
,,725817,晶焱統一16購02
,,725818,晶焱統一16購03
,,725819,晶焱統一18購01
,,725820,晶焱統一19購01
,,725821,精星統一16購01
,,725822,點序統一15購01
,,725823,穩懋統一15購01
,,725824,寶雅統一15購01
,,725825,統振國票15購01
,,725826,中光電第一1B購01
,,725827,昇達科第一1B購01
,,725828,穩懋中信15購01
,,725829,光頡永豐15購01
,,725830,佳邦永豐15購01
,,725831,昇佳電永豐15購01
,,725832,信驊永豐15購01
,,725833,晶焱永豐15購01
,,725834,晶焱永豐15購02
,,725835,新普永豐15購01
,,725836,精星永豐15購01
,,725837,穩懋永豐15購01
,,725838,晶焱麥證15購01
,,725839,久元國票16購01
,,725840,M31統一17購01
,,725841,元太統一15購02
,,725842,宏捷科統一16購03
,,725843,宏捷科統一17購01
,,725844,昇達科統一17購01
,,725845,昇達科統一17購02
,,725846,穩懋統一15購02
,,725847,大江凱基15購01
,,725848,元太凱基16購01
,,725849,胡連凱基15購01
,,725850,茂迪凱基15購01
,,725851,博智凱基15購02
,,725852,振曜富邦16購01
,,725853,良維群益15購01
,,725854,昇佳電群益16購01
,,725855,統振群益16購01
,,725856,湧德群益16購01
,,725857,鈺太群益15購01
,,725858,應廣群益15購01
,,725859,信驊元富15購01
,,725860,信驊元富16購01
,,725861,鈺太元富17購01
,,725862,穩懋兆豐16購01
,,725863,昇達科永豐15購01
,,725864,杰力永豐15購02
,,725865,信驊永豐15購02
,,725866,振曜永豐15購01
,,725867,神盾永豐15購01
,,725868,晟德永豐15購01
,,725869,晶焱永豐15購03
,,725870,鈺太永豐15購01
,,725871,碩禾永豐15購01
,,725872,九暘元大17購01
,,725873,宏捷科元大15購02
,,725874,宏捷科元大17購01
,,725875,昇佳電元大17購01
,,725876,杰力元大17購01
,,725877,信驊元大15購01
,,725878,茂達元大15購01
,,725879,原相元大15購02
,,725880,晶焱元大17購02
,,725881,雍智元大15購02
,,725882,網家元大17購02
,,725883,應廣元大17購01
,,725884,M31元大15購03
,,725885,力旺元大15購02
,,725886,力旺元大19購01
,,725887,久元元大17購01
,,725888,大田元大17購01
,,725889,元太元大15購02
,,725890,昇達科元大15購02
,,725891,昇達科元大17購01
,,725892,金麗科元大15購01
,,725893,金麗科元大15購02
,,725894,金麗科元大16購01
,,725895,金麗科元大17購01
,,725896,金麗科元大19購01
,,725897,晶焱元大15購03
,,725898,晶焱元大15購04
,,725899,精測元大15購04
,,725900,M31凱基16購01
,,725901,良維凱基16購01
,,725902,昇佳電凱基16購01
,,725903,金麗科凱基15購01
,,725904,神盾凱基15購01
,,725905,新普凱基16購01
,,725906,點序凱基15購02
,,725907,穩懋凱基15購02
,,725908,穩懋凱基18購01
,,725909,欣銓富邦16購01
,,725910,中美晶台新15購01
,,725911,穩懋台新15購01
,,725912,中美晶國票16購01
,,725913,金麗科國票16購01
,,725914,穩懋國票16購01
,,725915,九暘統一17購04
,,725916,宏捷科統一17購02
,,725917,宏捷科統一17購03
,,725918,點序統一18購01
,,725919,穩懋統一17購01
,,725920,穩懋統一17購02
,,725921,旺矽元富17購01
,,725922,金麗科元富15購01
,,725923,穩懋元富15購01
,,725924,穩懋元富18購01
,,725925,穩懋元富18購02
,,725926,長科*兆豐16購01
,,725927,雍智兆豐15購01
,,725928,精測康和15購01
,,725929,穩懋康和15購01
,,725930,穩懋康和18購01
,,725931,中美晶中信16購01
,,725932,信驊中信15購01
,,725933,晶焱中信15購01
,,725934,精測中信16購01
,,725935,穩懋中信15購02
,,725936,合晶永豐15購01
,,725937,昇達科永豐15購02
,,725938,金可永豐15購01
,,725939,金麗科永豐15購01
,,725940,穩懋永豐15購02
,,725941,穩懋國泰17購01
,,725942,M31群益15購02
,,725943,中美晶群益16購01
,,725944,宏捷科群益16購01
,,725945,昇達科群益15購01
,,725946,杰力群益15購01
,,725947,欣銓群益15購03
,,725948,鈊象群益16購01
,,725949,精星群益16購01
,,725950,點序群益15購01
,,725951,茂達國票16購01
,,725952,大田統一17購01
,,725953,中美晶統一16購04
,,725954,台半統一16購01
,,725955,合晶統一16購03
,,725956,宏捷科統一17購04
,,725957,昇達科統一16購02
,,725958,金可統一16購01
,,725959,茂達統一17購01
,,725960,晶焱統一15購06
,,725961,群聯統一15購03
,,725962,九暘凱基16購01
,,725963,昇達科凱基15購03
,,725964,杰力凱基17購01
,,725965,長科*凱基15購02
,,725966,茂迪凱基16購01
,,725967,晶焱凱基16購02
,,725968,碩禾凱基16購01
,,725969,精華凱基15購01
,,725970,網家凱基16購02
,,725971,昇達科麥證15購01
,,725972,朋程麥證16購01
,,725973,新普麥證15購01
,,725974,合晶國泰17購01
,,725975,昇達科國泰17購01
,,725976,朋程國泰17購01
,,725977,台半群益16購02
,,725978,台半群益17購01
,,725979,旺矽群益16購01
,,725980,昇達科群益18購01
,,725981,昇達科群益18購02
,,725982,朋程群益15購01
,,725983,朋程群益15購02
,,725984,合晶中信16購01
,,725985,金麗科中信16購01
,,725986,茂迪中信16購01
,,725987,神盾中信16購01
,,725988,萬潤兆豐15購01
,,725989,凡甲永豐15購01
,,725990,久元永豐15購01
,,725991,大田永豐15購01
,,725992,中光電永豐15購01
,,725993,日揚永豐15購01
,,725994,台半永豐15購01
,,725995,昇達科永豐15購03
,,725996,長科*永豐15購01
,,725997,原相永豐15購01
,,725998,森鉅永豐15購01
,,725999,聯亞永豐15購01
,,726000,原相康和15購01
,,726001,91APP*元大15購01
,,726002,元太元大17購02
,,726003,世界元大17購03
,,726004,台半元大19購01
,,726005,旺矽元大15購04
,,726006,昇達科元大17購02
,,726007,昇達科元大18購01
,,726008,朋程元大15購02
,,726009,朋程元大17購02
,,726010,茂迪元大17購01
,,726011,統振元大15購01
,,726012,統振元大17購01
,,726013,晶焱元大15購05
,,726014,晶焱元大15購06
,,726015,精測元大15購05
,,726016,世界台新15購01
,,726017,力旺富邦16購01
,,726018,中光電凱基16購01
,,726019,中美晶凱基15購02
,,726020,日揚凱基15購01
,,726021,台半凱基18購01
,,726022,合晶凱基17購02
,,726023,凌陽創凱基15購01
,,726024,紘康凱基15購03
,,726025,順達凱基15購01
,,726026,聯亞凱基15購01
,,726027,點序凱基15購03
,,726028,聯亞群益16購01
,,726029,合晶國票16購01
,,726030,安國國票15購01
,,726031,安國國票16購01
,,726032,東捷國票16購01
,,726033,茂迪國票16購01
,,726034,聯亞國票16購01
,,726035,凡甲統一16購01
,,726036,中光電統一16購02
,,726037,中光電統一16購03
,,726038,撼訊統一18購01
,,726039,璟德統一16購01
,,726040,大江元大15購02
,,726041,元太元大16購02
,,726042,台半元大15購04
,,726043,宏捷科元大15購03
,,726044,宏捷科元大19購01
,,726045,旺矽元大15購05
,,726046,中美晶元富16購01
,,726047,大江兆豐17購01
,,726048,元太兆豐17購01
,,726049,統振康和15購01
,,726050,統振康和17購01
,,726051,中美晶第一1B購01
,,726052,凡甲中信15購01
,,726053,中光電中信15購01
,,726054,宏捷科中信16購01
,,726055,世界永豐15購01
,,726056,朋程永豐15購01
,,726057,晶焱永豐15購04
,,726058,世界國票16購01
,,726059,立敦國票15購01
,,726060,立敦國票16購01
,,726061,朋程國票15購04
,,726062,朋程國票16購01
,,726063,金可國票16購01
,,726064,振曜國票16購01
,,726065,網家國票16購01
,,726066,中光電統一17購01
,,726067,台半統一16購02
,,726068,朋程統一16購02
,,726069,中美晶麥證17購01
,,726070,久元群益15購02
,,726071,中光電群益16購01
,,726072,中菲行群益16購01
,,726073,同致群益15購02
,,726074,合晶群益16購01
,,726075,合晶群益16購02
,,726076,佳邦群益16購01
,,726077,宣德群益16購01
,,726078,鈊象群益17購01
,,726079,世界中信15購01
,,726080,信昌電中信16購01
,,726081,聯亞中信15購01
,,726082,中菲行永豐15購01
,,726083,永昕永豐15購01
,,726084,信昌電永豐15購01
,,726085,建榮永豐15購01
,,726086,建榮永豐15購02
,,726087,鈊象永豐15購01
,,726088,台半凱基16購01
,,726089,台燿凱基15購01
,,726090,金可凱基15購01
,,726091,金麗科凱基15購02
,,726092,信昌電凱基15購01
,,726093,建榮凱基15購01
,,726094,雍智凱基16購01
,,726095,力旺元富1B購01
,,726096,旺矽元富17購02
,,726097,晶焱元富1B購01
,,726098,新普元富16購01
,,726099,力旺兆豐15購02
,,726100,久元元大15購01
,,726101,中美晶元大17購02
,,726102,宏捷科元大15購04
,,726103,長科*元大15購02
,,726104,胡連元大15購01
,,726105,茂迪元大15購01
,,726106,晶焱元大17購03
,,726107,雍智元大17購01
,,726108,碩禾元大19購01
,,726109,精測元大15購07
,,726110,中光電國票16購01
,,726111,中光電國票17購01
,,726112,中美晶國票16購02
,,726113,中菲行國票15購01
,,726114,同致國票15購01
,,726115,亞信國票16購01
,,726116,昇佳電國票15購01
,,726117,建榮國票15購01
,,726118,建錩國票15購01
,,726119,紘康國票16購01
,,726120,智崴國票15購01
,,726121,智崴國票16購01
,,726122,鈊象國票16購01
,,726123,精星國票15購01
,,726124,M31元大15購04
,,726125,大田元大16購01
,,726126,中美晶元大19購01
,,726127,台半元大16購03
,,726128,安國元大15購02
,,726129,宏捷科元大15購05
,,726130,亞信元大19購01
,,726131,胡連元大15購02
,,726132,聯亞元大15購01
,,726133,中菲行凱基16購01
,,726134,世界凱基15購04
,,726135,世界凱基16購01
,,726136,伍豐凱基15購01
,,726137,原相凱基16購01
,,726138,精測凱基15購02
,,726139,網家統一16購03
,,726140,網家國泰17購01
,,726141,大田群益15購02
,,726142,弘塑群益16購01
,,726143,伍豐群益18購01
,,726144,亞信群益15購01
,,726145,金居群益16購01
,,726146,信昌電群益15購01
,,726147,博智群益16購02
,,726148,雍智群益15購02
,,726149,弘塑元富16購01
,,726150,同致元富18購01
,,726151,鈊象元富18購01
,,726152,鈊象元富18購02
,,726153,精華元富16購01
,,726154,聯亞元富15購02
,,726155,力旺兆豐15購03
,,726156,亞信兆豐17購01
,,726157,晟德兆豐17購01
,,726158,中光電康和15購02
,,726159,鈊象康和15購01
,,726160,頎邦康和15購01
,,726161,台半中信15購01
,,726162,鈊象中信16購01
,,726163,雙鴻中信16購01
,,726164,台半永豐15購02
,,726165,弘塑永豐15購01
,,726166,伍豐永豐15購01
,,726167,旺矽永豐15購01
,,726168,富喬永豐15購01
,,726169,雍智永豐15購01
,,726170,精華永豐15購01
,,726171,中光電富邦16購01
,,726172,鈊象富邦16購01
,,726173,新鉅科富邦16購01
,,726174,中美晶國票17購01
,,726175,中探針國票16購01
,,726176,力旺統一16購02
,,726177,日揚統一16購01
,,726178,台半統一17購01
,,726179,欣銓統一16購01
,,726180,家登統一18購01
,,726181,良維元富18購01
,,726182,金居兆豐17購01
,,726183,家登兆豐17購01
,,726184,能率兆豐17購01
,,726185,茂達康和15購01
,,726186,原相國泰17購01
,,726187,中探針群益16購01
,,726188,亞信群益15購02
,,726189,中美晶富邦17購01
,,726190,M31永豐15購01
,,726191,金麗科永豐15購02
,,726192,家登永豐15購01
,,726193,廣明永豐15購01
,,726194,中美晶凱基17購01
,,726195,中美晶凱基18購01
,,726196,合晶凱基16購01
,,726197,宏捷科凱基15購02
,,726198,金居凱基15購02
,,726199,家登凱基15購02
,,726200,富喬凱基15購01
,,726201,鈊象凱基16購01
,,726202,群聯凱基17購03
,,726203,碩禾凱基17購01
,,726204,大田元大15購02
,,726205,中探針元大15購02
,,726206,中探針元大17購01
,,726207,日揚元大17購01
,,726208,世界元大15購04
,,726209,合晶元大15購01
,,726210,合晶元大17購02
,,726211,信音元大16購01
,,726212,原相元大17購01
,,726213,新普元大15購01
,,726214,萬泰科元大17購01
,,726215,雍智元大18購01
,,726216,優群元大16購01
,,726217,聯亞元大15購02
,,726218,世禾國票16購01
,,726219,同致國票16購01
,,726220,家登國票15購01
,,726221,創惟國票16購01
,,726222,創惟統一16購01
,,726223,創惟統一16購02
,,726224,創惟統一16購03
,,726225,創惟統一18購01
,,726226,博智統一17購01
,,726227,穩懋統一16購02
,,726228,世界元大19購01
,,726229,同致元大17購01
,,726230,合晶元大15購02
,,726231,昇佳電元大15購03
,,726232,創惟元大15購03
,,726233,創惟元大15購04
,,726234,創惟元大17購01
,,726235,創惟元大19購01
,,726236,鈊象元大15購02
,,726237,雍智元大15購03
,,726238,網家元大17購03
,,726239,穩懋元大15購03
,,726240,穩懋元大15購04
,,726241,穩懋元大17購03
,,726242,驊訊元大17購01
,,726243,合晶第一1B購01
,,726244,穩懋第一1B購01
,,726245,大國鋼永豐15購01
,,726246,加高永豐15購01
,,726247,創惟永豐15購01
,,726248,創惟永豐15購02
,,726249,智崴永豐15購01
,,726250,大國鋼富邦15購01
,,726251,創惟富邦16購01
,,726252,創惟凱基15購01
,,726253,創惟凱基16購01
,,726254,創惟凱基17購01
,,726255,智冠凱基15購01
,,726256,聯亞凱基15購02
,,726257,創惟國泰17購01
,,726258,創惟國泰17購02
,,726259,撼訊國泰17購01
,,726260,驊訊國泰17購01
,,726261,亞信群益15購03
,,726262,金麗科群益15購01
,,726263,金麗科群益15購02
,,726264,威剛群益15購02
,,726265,創惟群益15購01
,,726266,創惟群益15購02
,,726267,博智群益16購03
,,726268,金可兆豐17購01
,,726269,創惟康和15購01
,,726270,創惟康和15購02
,,726271,創惟康和18購01
,,726272,世界元富15購02
,,726273,創惟元富18購01
,,726274,創惟元富18購02
,,726275,創惟元富18購03
,,726276,萬潤元富15購02
,,726277,群聯元富18購01
,,726278,僑威元富15購01
,,726279,世界統一17購01
,,726280,創惟統一17購01
,,726281,創惟統一18購02
,,726282,創惟統一19購01
,,726283,精材統一17購01
,,726284,精材統一17購02
,,726285,網家統一17購01
,,726286,穩懋統一17購03
,,726287,中美晶元大17購03
,,726288,家登元大15購02
,,726289,創惟元大15購05
,,726290,創惟元大15購06
,,726291,鈊象元大17購02
,,726292,聚和元大15購01
,,726293,聚和元大17購02
,,726294,世界群益16購01
,,726295,創惟群益15購03
,,726296,鈊象群益16購02
,,726297,碩禾群益18購01
,,726298,網家群益15購02
,,726299,聚和群益15購01
,,726300,中美晶凱基16購01
,,726301,威剛凱基16購01
,,726302,創惟凱基15購02
,,726303,創惟凱基15購03
,,726304,精材第一1B購01
,,726305,金居中信16購01
,,726306,威剛中信16購01
,,726307,精材中信16購01
,,726308,中美晶永豐15購01
,,726309,合晶永豐15購02
,,726310,良維永豐15購01
,,726311,亞信永豐15購01
,,726312,宜鼎永豐15購01
,,726313,創惟永豐16購01
,,726314,精材永豐15購01
,,726315,聚和永豐16購02
,,726316,亞信元富18購01
,,726317,臺慶科元富15購01
,,726318,創惟富邦17購01
,,726319,博智富邦17購01
,,726320,精材富邦17購02
,,726321,聚和富邦15購01
,,726322,穩懋富邦17購01
,,726323,力旺國票16購01
,,726324,大學光國票16購01
,,726325,世界國票16購02
,,726326,良維國票16購01
,,726327,宜特國票15購01
,,726328,旺矽國票16購01
,,726329,原相國票16購01
,,726330,創惟國票16購02
,,726331,創惟國票16購03
,,726332,群聯國票16購01
,,726333,精材國票16購01
,,726334,臺慶科國票15購01
,,726335,類比科國票15購01
,,726336,驊訊國票16購02
,,726337,元太元大15購04
,,726338,台半元大18購01
,,726339,合晶元大17購03
,,726340,創惟元大17購02
,,726341,創惟元大17購03
,,726342,創惟元大18購01
,,726343,雍智元大18購02
,,726344,碩禾元大18購02
,,726345,點序元大17購01
,,726346,點序元大18購02
,,726347,中光電統一16購04
,,726348,中光電統一17購02
,,726349,創惟統一19購02
,,726350,智崴統一17購01
,,726351,鈊象統一16購02
,,726352,鈊象統一16購03
,,726353,鈊象統一16購04
,,726354,群聯統一16購02
,,726355,M31凱基16購02
,,726356,中光電凱基15購01
,,726357,世界凱基16購02
,,726358,亞信凱基15購03
,,726359,金居凱基16購01
,,726360,茂迪凱基16購02
,,726361,智崴凱基16購01
,,726362,台半麥證19購01
,,726363,聚和國泰17購01
,,726364,中美晶群益15購01
,,726365,群聯群益15購02
,,726366,精測群益16購01
,,726367,九暘富邦17購01
,,726368,世界富邦17購01
,,726369,合晶富邦16購01
,,726370,金居富邦16購01
,,726371,茂迪富邦16購01
,,726372,創惟富邦19購01
,,726373,元太元富18購01
,,726374,鈊象元富18購03
,,726375,合晶兆豐16購01
,,726376,家登康和15購01
,,726377,創惟康和18購02
,,726378,群聯康和15購01
,,726379,中光電第一1B購02
,,726380,世界第一1B購02
,,726381,智崴中信15購01
,,726382,中光電永豐15購02
,,726383,朋億永豐15購01
,,726384,胡連永豐15購01
,,726385,創惟永豐15購03
,,726386,智崴永豐15購02
,,726387,點序永豐16購01
,,726388,台半國票16購01
,,726389,光頡國票15購01
,,726390,雙鴻國票16購01
,,726391,中光電統一18購01
,,726392,同致統一18購01
,,726393,朋程統一17購01
,,726394,合晶凱基17購03
,,726395,朋程凱基17購01
,,726396,金麗科凱基16購01
,,726397,群聯凱基16購01
,,726398,合晶元大15購03
,,726399,合晶元大15購04
,,726400,朋程元大15購04
,,726401,金麗科元大15購03
,,726402,智崴元大15購01
,,726403,智崴元大15購02
,,726404,聯亞富邦17購01
,,726405,中光電群益16購02
,,726406,世禾群益15購01
,,726407,亞信群益15購04
,,726408,創惟群益18購01
,,726409,創惟群益18購02
,,726410,萬潤群益16購01
,,726411,榮剛群益15購01
,,726412,磐亞群益16購01
,,726413,聯亞群益15購01
,,726414,中光電元富15購01
,,726415,中光電元富17購01
,,726416,朋程元富18購03
,,726417,朋程元富18購04
,,726418,金麗科元富15購02
,,726419,胡連兆豐15購01
,,726420,鈺太兆豐17購01
,,726421,中光電康和15購03
,,726422,中光電康和17購01
,,726423,金麗科康和15購01
,,726424,金麗科康和16購01
,,726425,元太第一1B購01
,,726426,中光電中信15購02
,,726427,金麗科中信17購01
,,726428,九暘永豐15購01
,,726429,中光電永豐15購03
,,726430,宜特永豐15購01
,,726431,金麗科永豐15購03
,,726432,茂達永豐15購01
,,726433,創惟永豐17購01
,,726434,萬潤永豐15購01
,,726435,榮剛永豐15購01
,,726436,中光電國泰17購01
,,726437,大江群益15購01
,,726438,加高群益15購01
,,726439,金麗科群益15購03
,,726440,紘康群益15購01
,,726441,九暘凱基16購02
,,726442,金麗科凱基16購02
,,726443,金麗科凱基17購01
,,726444,智崴凱基15購01
,,726445,萬潤凱基15購01
,,726446,榮剛凱基16購01
,,726447,聚和凱基15購02
,,726448,雙鴻凱基16購01
,,726449,元太元大15購05
,,726450,合晶元大17購04
,,726451,杰力元大17購02
,,726452,金麗科元大15購04
,,726453,金麗科元大17購02
,,726454,宣德元大15購01
,,726455,茂達元大15購02
,,726456,智崴元大15購03
,,726457,智崴元大15購04
,,726458,網家元大15購02
,,726459,中光電國票15購02
,,726460,中光電國票17購02
,,726461,中美晶國票16購03
,,726462,金麗科國票16購02
,,726463,胡連國票16購01
,,726464,大國鋼統一16購01
,,726465,金麗科統一17購01
,,726466,金麗科統一18購01
,,726467,金麗科統一19購01
,,726468,群聯統一18購01
,,726469,聚和統一15購02
,,726470,元太富邦17購01
,,726471,茂達富邦15購01
,,726472,驊訊富邦16購01
,,726473,中美晶元富18購01
,,726474,台半元富17購01
,,726475,良維元富17購01
,,726476,金麗科元富15購03
,,726477,金麗科元富15購04
,,726478,昇佳電兆豐17購01
,,726479,聚和兆豐16購01
,,726480,中光電中信16購01
,,726481,金麗科中信15購01
,,726482,金麗科中信18購01
,,726483,中光電永豐15購04
,,726484,金麗科永豐15購04
,,726485,長聖永豐15購01
,,726486,紘康永豐15購01
,,726487,茂達元富15購01
,,726488,鈺太元富15購01
,,726489,驊訊康和19購01
,,726490,中光電台新15購02
,,726491,茂達國泰17購01
,,726492,頎邦國泰17購01
,,726493,中光電群益16購03
,,726494,宏捷科群益15購02
,,726495,金居群益16購02
,,726496,茂達群益16購01
,,726497,鈺太群益15購02
,,726498,驊訊群益17購01
,,726499,中光電凱基16購02
,,726500,中菲行凱基16購02
,,726501,金居凱基15購03
,,726502,長科*凱基15購03
,,726503,胡連凱基15購02
,,726504,茂達凱基15購02
,,726505,鈺太凱基15購01
,,726506,鈺太凱基16購01
,,726507,聚和凱基16購02
,,726508,禾瑞亞富邦16購01
,,726509,鈺太富邦19購01
,,726510,91APP*統一17購03
,,726511,中光電統一17購03
,,726512,凌陽創統一16購01
,,726513,聚和統一15購03
,,726514,雙鴻統一16購01
,,726515,中光電麥證15購01
,,726516,元太麥證17購01
,,726517,M31中信15購01
,,726518,中光電中信17購01
,,726519,長聖中信15購01
,,726520,鈺太中信16購01
,,726521,91APP*永豐15購01
,,726522,M31永豐15購02
,,726523,力旺永豐15購01
,,726524,久元永豐15購02
,,726525,大宇資永豐15購01
,,726526,中光電永豐15購05
,,726527,旺矽永豐16購01
,,726528,金居永豐15購01
,,726529,智崴永豐15購03
,,726530,新普永豐15購02
,,726531,鈺太永豐15購02
,,726532,聚和永豐16購03
,,726533,驊訊永豐16購01
,,726534,九暘元大15購01
,,726535,良維元大17購01
,,726536,朋程元大15購05
,,726537,威剛元大17購01
,,726538,宣德元大17購01
,,726539,胡連元大15購03
,,726540,茂迪元大15購02
,,726541,茂達元大17購01
,,726542,家登元大17購01
,,726543,鈊象元大15購03
,,726544,萬潤元大15購02
,,726545,群聯元大15購04
,,726546,群聯元大17購03
,,726547,穩懋元大15購05
,,726548,鑫科元大15購01
,,726549,安格元大15購01
,,726550,茂達元大15購03
,,726551,振曜元大15購01
,,726552,紘康元大19購01
,,726553,博智元大15購02
,,726554,萬潤元大15購03
,,726555,群聯元大15購05
,,726556,達爾膚元大17購01
,,726557,鈺太元大15購01
,,726558,雙鴻元大17購01
,,726559,穩懋元大15購06
,,726560,穩懋元大17購04
,,726561,中光電統一16購05
,,726562,中光電統一17購04
,,726563,金居統一16購02
,,726564,金居統一16購03
,,726565,金居統一17購01
,,726566,中菲行麥證17購01
,,726567,力旺凱基16購03
,,726568,大江凱基15購02
,,726569,中菲行凱基17購01
,,726570,元太凱基16購02
,,726571,威剛凱基18購01
,,726572,振曜凱基15購01
,,726573,新普凱基16購02
,,726574,精星富邦18購01
,,726575,亞信國泰17購01
,,726576,金居中信16購02
,,726577,頎邦中信16購01
,,726578,中菲行永豐15購02
,,726579,日揚永豐15購02
,,726580,精星永豐15購02
,,726581,廣運永豐15購01
,,726582,璟德永豐15購01
,,726583,力旺元富15購02
,,726584,力旺元富15購03
,,726585,中美晶元富18購02
,,726586,台半元富18購01
,,726587,亞信元富19購01
,,726588,杰力元富17購01
,,726589,金居元富16購01
,,726590,鈺太元富16購01
,,726591,穩懋兆豐15購01
,,726592,九暘康和16購01
,,726593,安格康和15購01
,,726594,金居康和15購01
,,726595,91APP*群益16購01
,,726596,九暘群益18購01
,,726597,中菲行群益16購02
,,726598,日揚群益16購01
,,726599,安國群益16購02
,,726600,威剛群益15購03
,,726601,茂迪群益15購01
,,726602,凌陽創群益16購01
,,726603,群聯群益15購03
,,726604,91APP*國票15購01
,,726605,宏捷科國票16購01
,,726606,漢磊國票16購02
,,726607,雙鴻國票16購02
,,726608,宏捷科麥證17購01
,,726609,朋程麥證18購01
,,726610,漢磊麥證15購01
,,726611,漢磊麥證17購01
,,726612,穩懋麥證17購01
,,726613,驊訊麥證16購01
,,726614,中美晶凱基16購02
,,726615,同致凱基15購03
,,726616,合晶凱基16購02
,,726617,宏捷科凱基16購01
,,726618,凌陽創凱基16購01
,,726619,漢磊凱基15購04
,,726620,漢磊凱基16購02
,,726621,漢磊凱基17購02
,,726622,璟德凱基15購03
,,726623,雙鴻凱基16購02
,,726624,穩懋凱基16購01
,,726625,穩懋凱基16購02
,,726626,加高富邦15購01
,,726627,新普富邦15購01
,,726628,漢磊富邦15購01
,,726629,漢磊富邦19購01
,,726630,漢磊第一1B購01
,,726631,漢磊第一25購01
,,726632,中光電永豐15購06
,,726633,加高永豐15購02
,,726634,茂達永豐15購02
,,726635,凌陽創永豐15購01
,,726636,博智永豐15購01
,,726637,雍智永豐15購02
,,726638,漢磊永豐15購01
,,726639,漢磊永豐15購02
,,726640,漢磊永豐16購01
,,726641,漢磊永豐18購01
,,726642,臺慶科永豐15購01
,,726643,漢磊國泰17購01
,,726644,漢磊國泰17購02
,,726645,漢磊國泰17購03
,,726646,合晶群益16購03
,,726647,威剛群益15購04
,,726648,漢磊群益16購02
,,726649,漢磊群益16購03
,,726650,漢磊群益16購04
,,726651,漢磊群益17購03
